,Name,Description,Brand,Price,Image
0,Prevue Pet Cuttlebone for Small Birds 2pcs×10.2cm,"Prevue Pet Cuttlebone for Small Birds 2pcs×10.2cm

a natural source of calcium and minerals for birds.
Cuttlebones help keep the birds’ beaks and nails trimmed and healthy and can be easily clipped to any cage.
Cuttlebones are suitable for small and extra-small birds, such as finches, canaries, parakeets, and cockatiels.
Cuttlebones measure approximately 4 inches long (max) and come in a natural colour.
For small and very small Birds",Prevue Pet,5.5,//aleef.com/cdn/shop/files/PrevuePetCuttleboneforSmallBirds2pcsx10.2cm.jpg?v=1688629272
1,Beaphar Eye Gel for all Pets,"Beaphar Eye Gel for all Pets

A sterile liquid gel to soothe and relieve dry and irritated eyes. 
Once applied to the eye, the gel gently softens and melts across the cornea to provide instant relief and reduce discomfort caused by dry eyes. 
Beaphar Eye Gel contains Vitamin A to help protect and repair the surface of the eye.
Ideal for helping your pet’s eyes to naturally clean dust and debris away.
Suitable for all animals, big and small.

Instructions1. Remove the screw cap on the tube.2. Hold your pet gently but firmly and place a single drop of Beaphar Eye Gel directly onto the surface of the eye, ensuring the tube does not touch the eye. You may find it helpful to support your pet in a towel to help restrain them while you are administering the Beaphar Eye Gel.3. The gel will gently melt across the surface of the eye.If required, this can be repeated every four hours.IMPORTANT:

Dispose of Beaphar Eye Gel 28 days after opening and replace it with a new one.",Beaphar,35.0,//aleef.com/cdn/shop/products/BeapharEyeGelforallPets.jpg?v=1674975039
2,Versele-Laga Prestige Kristal 2kg,Versele-Laga Prestige KristalWhite shell sand with aniseed. sterilized at high temperatureRefreshing scent. does not make dust and is environmentally friendly,Versele Laga,16.0,//aleef.com/cdn/shop/products/e7877f0de3db6452e68ccf6b655b7d3987bd60be.jpg?v=1658656136
3,"Prevue Pet CUTTLEBONE For Large & X-Large Birds ,6 inches long 2 Piece","Prevue Pet CUTTLEBONE For Large & X-Large Birds ,6 inches long 2 PieceCuttlebone is essential for all birds and promotes good health by keeping beaks and nails trimmedIncludes one metal hanger",Prevue Pet,22.0,//aleef.com/cdn/shop/products/PrevuePetCUTTLEBONEForLarge_X-LargeBirds_5incheslong.jpg?v=1669531785
4,"Prevue Pet CUTTLEBONE For Small Birds, 4 inches long Flavoured","Prevue Pet CUTTLEBONE For Small Birds, 4 inches long Flavoured  Cuttlebone is essential for all birds and promotes good health by keeping beaks and nails trimmedIncludes one metal hanger",Prevue Pet,10.2,//aleef.com/cdn/shop/products/PrevuePetCUTTLEBONEForSmallBirds_4incheslongFlavoured.jpg?v=1669533925
5,"Prevue Pet CUTTLEBONE For Small Birds , 4-inches long 6 Piece","Prevue Pet CUTTLEBONE For Small Birds , 4-inches long 6 Piece Cuttlebone is essential for all birds and promotes good health by keeping beaks and nails trimmedIncludes one metal hanger",Prevue Pet,35.0,//aleef.com/cdn/shop/products/PrevuePetCUTTLEBONEForSmallBirdsVanilla-flavoured_4incheslong6Packs.jpg?v=1669532484
6,حوض استحمام للطيور الصغيرة,"يمكن تركيبه على أغلب أقفاص الطيور
يتم تعليقة في فتحة الباب 
سهل التنظيف والإستخدام
مناسب للطيور الصغيرة
مصنوع من البلاستيك




مصنوع في ايطاليا",Zolux,28.87,//aleef.com/cdn/shop/products/3336021342216.jpg?v=1658654908
7,Versel-Laga Prestige KRISTAL - WHITE 5kg,Versel-Laga Prestige KRISTAL 15%SHELL SAND - WHITE 5kg White shell sand. .White shell sand with aniseed. sterilized at high temperature Refreshing scent. does not make dust and is environmentally friendly,Versele Laga,33.0,//aleef.com/cdn/shop/products/5410340230046.jpg?v=1658654181
8,"Zolux Litter for Bird cages and Aviaries, Anise fragrance, 2 Kg","Zolux Litter for Bird cages and Aviaries, Anise fragrance, 2 Kg 
Litter of quartz sand: 
helps digest seeds, with ground seashells and natural anise fragrance that covers bad odors. 
Ingredients: 
Quartzite, Ground seashells, Natural anise fragrance.
Directions: 
Spread a thin layer on the bottom of the cage. 
Remove, clean and replace at least once a week or more often if necessary.",Zolux,18.0,//aleef.com/cdn/shop/products/ZoluxLitterforBirdcagesandAviaries_Anisefragrance_2Kg.jpg?v=1671535635
9,"Prevue Pet CUTTLEBONE For Small Birds , 4-inches long","Prevue Pet CUTTLEBONE For Small Birds , 4-inches long  Cuttlebone is essential for all birds and promotes good health by keeping beaks and nails trimmedIncludes one metal hanger",Prevue Pet,7.0,//aleef.com/cdn/shop/products/PrevuePetCUTTLEBONEForSmallBirdsVanilla-flavoured_4incheslong.jpg?v=1669530621
10,ZOLUX BIRDYCOB NATURE LITTER FOR BIRDS,"ZOLUX BIRDYCOB NATURE LITTER FOR BIRDS


Composed of corn cob. it is 100% biodegradable.
Natural litter, dust-free, with strong absorbent power.
Made of corncob
The fine granulometry reinforces the absorbency of liquids and odours and improves the aesthetic aspect",Zolux,33.0,//aleef.com/cdn/shop/products/ZOLUXBIRDYCOBNATUREFORBIRDS.jpg?v=1665393263
11,"Prevue Pet CUTTLEBONE For Small Birds , 4 inches-long 25 piece","Prevue Pet CUTTLEBONE For Small Birds , 4 inches-long 25 pieceCuttlebone is essential for all birds and promotes good health by keeping beaks and nails trimmedIncludes one metal hanger",Prevue Pet,127.0,//aleef.com/cdn/shop/products/PrevuePetCUTTLEBONEForSmallBirdsVanilla-flavoured_4incheslong25piece.jpg?v=1669533330
12,External Bath for Small Birds (134221),Bird bath attaches securely onto most wire bird cagesTo hang in front of the cage doorVery easy to clean and maintainPlasticMade in Italy,Zolux,28.87,//aleef.com/cdn/shop/products/3336021342209.jpg?v=1658654909
13,"Prevue Pet CUTTLEBONE For Medium & Large Birds ,5 inches long","Prevue Pet CUTTLEBONE For Medium & Large Birds ,5 inches longCuttlebone is essential for all birds and promotes good health by keeping beaks and nails trimmedIncludes one metal hanger",Prevue Pet,10.0,//aleef.com/cdn/shop/products/PrevuePetCUTTLEBONEForMedium_LargeBirds_5incheslong.jpg?v=1669531241
14,"Zolux Ani-Sand Nature, Anise Scent 5kg For Birds","Zolux Ani-Sand Nature, Anise Scent 5kg For Birds

Birdcage litter and aviaries with the smell of anise are composed of sand and ground shells, which at the same time help good digestion. Ground shells are a source of calcium for good growth, and feathers and the smell of anise hides unpleasant odours.
Application:
Apply a thin layer to the bottom of the cage. Remove, clean and replace at least once a week or more frequently if necessary.
Recommendation:
Combine both products and place AniSand Crystal on the bottom of the cage for a clean, fresh look and Ani-Sand Nature in the feeder or bath for maximum digestive assistance.",Zolux,24.0,//aleef.com/cdn/shop/products/ZoluxAni-SandNature_AniseScent5kgForBirds.jpg?v=1665391340
15,Versel-Laga Prestige MARINE SHELL SAND 5kg,White shell sand with oyster shells White shell sand with aniseed. sterilized at high temperature Contains 40 % oyster shells. small shells and minerals Refreshing scent. does not make dust and is environmentally friendly,Versele Laga,33.0,//aleef.com/cdn/shop/products/5410340230053.jpg?v=1658653513
16,Sanibird Bird Litter Rosmary Scent 20L,"Sanibird Bird Litter Rosmary Scent 20L

A type of bedding that is used to cover the bottom of a bird cage.
It helps to absorb bird droppings and minimize odor, as well as providing some grit for the bird’s digestion.
made from natural minerals with high absorption and odour control power, suitable for bird cages.
Our litter helps to reduce moisture and minimise the risk of Coccidiosis.
High absorption power for unwanted odours and dampness prevents coccidiosis, creating a hygienic environment for the bird's cleanliness and care for every bird
easy to use and dispose of.
Spread a thin layer of bird sand litter on the bottom of the cage and change it regularly to maintain a healthy environment for your bird.
Bird sand litter suits all birds, from budgies and canaries to parrots and cockatiels.
Try bird sand litter today and see the difference it makes for your bird's well-being!",Sanibird,93.5,//aleef.com/cdn/shop/files/SanibirdBirdLitterRosmaryScent20L.jpg?v=1682408651
17,oropharma jungle shower 500 ml,"Feather conditionerOropharma Jungle Shower is a spray with aloe vera for glossy plumage and a healthy skin. This care product cleans the feathers, restores the balance of moisture of the skin and feathers, limits the loss of feather dust and helps to keep the skin healthy.Ideal as a shower for pet birdsA beneficent treatment for the bird's skin and plumageCleans and refreshes the feathers softly",Versele Laga,110.0,//aleef.com/cdn/shop/products/5410340602232.jpg?v=1658654492
18,"Versele Laga  Oropharma No-Pick feather plucking Preventer Spary for Birds, 100mL","Versele Laga  Oropharma No-Pick feather plucking Preventer Spary for Birds, 100mLThis product protects growing youngsters from feather plucking by parent animals and helps to prevent feather pecking and self-mutilation.Protects against feather pecking because of its very bitter tasteProtects youngsters from feather plucking by parent animalsHelps in cases where birds are pecking their own feathersDIRECTIONS FOR USESpray on the feathers once per day. Warning: do not spray in the eyes or the beak. Keep out of reach of children.",Versele Laga,72.0,//aleef.com/cdn/shop/products/VerseleLagaOropharmaNo-PickfeatherpluckingPreventerSparyforBirds_100mL.jpg?v=1667991743
19,"Prevue Pet CUTTLEBONE For Medium & Large Birds ,6 inches long","Prevue Pet CUTTLEBONE For Medium & Large Birds ,6 inches longCuttlebone is essential for all birds and promotes good health by keeping beaks and nails trimmedIncludes one metal hanger",Prevue Pet,12.0,//aleef.com/cdn/shop/products/PrevuePetCUTTLEBONEForLarge_X-LargeBirds_6Inches.jpg?v=1670312568
20,"Cement Perch for Small Birds 7 inch, Multiple colours","Cement Perch for Small Birds 7 inch, GrayNaturally trims nails & beakSold by color availableAttaches easily - color safeSafe, textured, non-skid surface",Penn Plax,42.43,//aleef.com/cdn/shop/products/CementPerchforSmallBirds7inch2.jpg?v=1668417514
21,بيفار يساعد في علاج الجروح السطحية وايقاف الحكة للطيور 25 جرام,"بيفار علاج الجروح السطحية لدى الطيور ويعمل على ايقاف الحكة
طريقة الاستخدام :







في حال الجرح : يوضع على الجرح عدة مرات في اليوم حتى يشفى
في حال الحكة : يوضع مرة في اليوم لمدة 6 ايام
يجب تدليك المكان وقص الريش لمكان الاصابة حتى يتمكن العلاج من الوصول الى المكان المطلوب",Beaphar,39.27,//aleef.com/cdn/shop/products/8710729055213.jpg?v=1658655630
22,Zolux Hanging Metal Fruit Pick- Medium,Great for serving fruits and vegetables for bird in a more engaging way!Suitable for all bird cagesEasy to fixHigh quality and durable,Zolux,11.55,//aleef.com/cdn/shop/products/3336021340472.jpg?v=1658654925
