,Name,Description,Brand,Price,Image
28,Espree Cat Clean Ear Treatment for Cats 118ml,"Espree Cat Clean Ear Treatment for Cats 118mlA cat’s ears can get dirty and smelly if not properly cared forEspree Cat Ear Care's blend of natural essential oils removes dirt and debris, including odour-causing ear wax, to restore the ears’ natural balance and healthFormulated with natural ingredients of peppermint and eucalyptusMade with 100 Percent Organically Grown Aloe Vera",Espree,45.0,//aleef.com/cdn/shop/products/7_7e686387-8770-4bf4-9542-6b296605cf3c.jpg?v=1658655275
29,اسبري قطرة منظف للعیون والبقع بدون رائحة للكلاب والقطط 118مل,استعادة اللون الطبيعي يعيد نعومة الفراء البابونج والكامبور يزيلان البقع بلطف مصنوع من الألوفيرا المزروع عضوياً 100٪ صنع في الولايات المتحدة الأمريكية,Espree,60.0,//aleef.com/cdn/shop/products/5ef9bc4464da2c301b1d8615c1570c8026f13f6c.jpg?v=1658655273
30,Zolux furniture Cleaning Brush,Zolux furniture Cleaning BrushThis cleaning brush with the special nubs on it get rid of hair and dirt on the furniture Always brush in the same direction for the best result,Zolux,16.5,//aleef.com/cdn/shop/products/3336024035009.jpg?v=1658654865
31,Cature Purelab Eye Cleanser For Dog and Cat 120ml,"Cature Purelab Eye Cleanser For Dog and Cat 120ml1. Helps soften and removes dried secretions2. Cleans pet's eyes and eyelids.  Removes foreign bodies (plant debris, dust, sand, etc)3. Soothes and nourishes the eyes and skin around the eye around.4. Inhibits bacterial growth, preventing infection. CAUTION:* For animal use only. To prevent contamination of the liquid, please avoid bottle mouth directly touching eye or skin.DIRECTIONS FOR USE:* How to open: Turn the white nozzle to open the product.RINSE: Gently pour the liquid into your pet's eyes, and wipe the dirt, foreign objects and excess liquid with a clean cloth. Repeat this process until the eyes are clean.WIPE: Pour the liquid into a clean cloth and gently wipe the eye around until it's clean.",Cature,45.0,//aleef.com/cdn/shop/products/6970989893013.jpg?v=1658654441
32,Inodorina Silicon lint Roller,Inodorina Silicon lint RollerInodorina Roller removes quickly and easily dirt and loose hair from all surfaces.It's washable and reusable.,Inodorina,33.0,//aleef.com/cdn/shop/products/8031398124605.jpg?v=1658654203
33,Petlinks odor absorbing sachets,Petlinks odor absorbing sachetsIt;s an absorbing odor sachets for both cats and dogs .. It is safe and easy to use.It's the best solution for stinky smells.,PetLinks,28.6,//aleef.com/cdn/shop/products/786306440022.jpg?v=1658654082
34,Sanal Ear Cleaner 50ml,"For dogs, cats and rodentsMoisturizing ear cleaner to help prevent scratchingMild & caring ear cleanerHelps to remove dirt around the earsHow To UseDeeply insert 5-10 drops into the ear canal and then softly massage the ear canal about 1 minute, so that it can dissolve dirt. Your pet will shake himself to dissolve the dirt and wax from his ears. Remove visible residues with a dry cotton ball. Do not use on open wounds.",Sanal,41.8,//aleef.com/cdn/shop/products/8711908605007.jpg?v=1658653457
